<?xml version="1.0" encoding="UTF-8"?>


<H2Z4X3_autokolcsonzo xmlns:xs="http://www.w3.org/2001/XMLSchema-instance"
xs:noNamespaceSchemaLocation="XMLSchemah2z4x3.xsd">
    
    <!-- TELEP -->
    <telep TELEP_ID = "1">
        <kapacitás>5</kapacitás>  
        <cim>
            <település>Budapest</település>
            <utca>Benczúr_utca</utca>
            <házszám>23</házszám>
       </cim>
       <minősítés>B</minősítés>
    </telep>

    <telep TELEP_ID = "2">
        <kapacitás>8</kapacitás>  
        <cim>
            <település>Budapest</település>
            <utca>Jókai_utca</utca>
            <házszám>14</házszám>
       </cim>
       <minősítés>A</minősítés>
    </telep>

    <telep TELEP_ID = "3">
        <kapacitás>6</kapacitás>  
        <cim>
            <település>Szeged</település>
            <utca>Szabadság_utca </utca>
            <házszám>23</házszám>
       </cim>
       <minősítés>C</minősítés>
    </telep>

    <telep TELEP_ID = "4">
        <kapacitás>7</kapacitás>  
        <cim>
            <település>Siófok</település>
            <utca>Balaton_utca</utca>
            <házszám>45</házszám>
       </cim>
       <minősítés>A</minősítés>
    </telep>


    <!-- TULAJDONOS-->
    <tulajdonos TUL_ID="1" TUL_TELEP="1" >
        <név>Kis János</név>
        <telszám>067022344555</telszám>
        <adoszam>12345678-1-11</adoszam>
        <bevétel>1500000</bevétel>
    </tulajdonos>

    <tulajdonos TUL_ID="2" TUL_TELEP="2" >
        <név>Cicz Imre</név>
        <telszám>06205678899</telszám>
        <adoszam>18384763-2-24</adoszam>
        <bevétel>1234560</bevétel>
    </tulajdonos>

    <tulajdonos TUL_ID="3" TUL_TELEP="3" >
        <név>Cset Elek</név>
        <telszám>06703452233</telszám>
        <adoszam>12345679-3-13</adoszam>
        <bevétel>1800000</bevétel>
    </tulajdonos>

    <tulajdonos TUL_ID="4" TUL_TELEP="4" >
        <név>Kis Anikó</név>
        <telszám>06304567788</telszám>
        <adoszam>12341236-2-31</adoszam>
        <bevétel>1850000</bevétel>
    </tulajdonos>


    <!-- AUTOK-->
    <autok AUTO_ID="1" AUTO_TELEP="1" >
        <rendszám>PSY-213</rendszám>
        <modell>Jaguar_F-TYPE</modell>
        <alvázszám>JZMMA18P200411817</alvázszám>
        <gyártásiév>2019</gyártásiév>
    </autok>

    <autok AUTO_ID="2" AUTO_TELEP="2" >
        <rendszám>RYZ-022</rendszám>
        <modell>Mercedes_S63_AMG</modell>
        <alvázszám>JZMMA18P201111111</alvázszám>
        <gyártásiév>2020</gyártásiév>
    </autok>

    <autok AUTO_ID="3" AUTO_TELEP="3" >
        <rendszám>SUV-123</rendszám>
        <modell>Volvo_XC-90</modell>
        <alvázszám>KMMMA18P202345234</alvázszám>
        <gyártásiév>2021</gyártásiév>
    </autok>

    <autok AUTO_ID="4" AUTO_TELEP="2" >
        <rendszám>SRY-345</rendszám>
        <modell>Audi_A5</modell>
        <alvázszám>PZMMA18P200434567</alvázszám>
        <gyártásiév>2020</gyártásiév>
    </autok>

    <autok AUTO_ID="5" AUTO_TELEP="4" >
        <rendszám>PSY-234</rendszám>
        <modell>BMW_M5_Competition</modell>
        <alvázszám>KMMMA18P200413259</alvázszám>
        <gyártásiév>2018</gyártásiév>
    </autok>



    <!-- BÉRLŐ-->
    <bérlő BÉRLŐ_ID="1" BÉRLŐ_AUTO="2">
        <név>Diz Elek</név>
        <telszám>06703439988</telszám>
        <email>dizelek@gmail.com</email>
        <jogositvanyszam>CM001001</jogositvanyszam>
    </bérlő>

    <bérlő BÉRLŐ_ID="2" BÉRLŐ_AUTO="3">
        <név>Farkas Piroska</név>
        <telszám>06209876677</telszám>
        <email>piroksa@gfreemail.hu</email>
        <jogositvanyszam>WW001002</jogositvanyszam>
    </bérlő>

    <bérlő BÉRLŐ_ID="3" BÉRLŐ_AUTO="4">
        <név>Feles Elek</név>
        <telszám>06708995544</telszám>
        <email>felelek@gmail.com</email>
        <jogositvanyszam>MM020105</jogositvanyszam>
    </bérlő>

    <bérlő BÉRLŐ_ID="4" BÉRLŐ_AUTO="5">
        <név>Git Áron</név>
        <telszám>06204563322</telszám>
        <email>gitaron@citromail.hu</email>
        <jogositvanyszam>KK011501</jogositvanyszam>
    </bérlő>


    <!-- ALKALMAZOTTAK-->
    <alkalmazott ALK_ID="1" ALK_TELEP="2"> 
        <név>Hideg Ottó</név>
        <beosztás>Adminisztrátor</beosztás>
        <életkor>48</életkor>
        <születésiév>1975</születésiév>
    </alkalmazott>

    <alkalmazott ALK_ID="2" ALK_TELEP="3"> 
        <név>Kis Eszter</név>
        <beosztás>Üzletvezető</beosztás>
        <életkor>45</életkor>
        <születésiév>1978</születésiév>
    </alkalmazott>

    <alkalmazott ALK_ID="3" ALK_TELEP="1"> 
        <név>Pat Tamás</név>
        <beosztás>supervisor</beosztás>
        <életkor>35</életkor>
        <születésiév>1988</születésiév>
    </alkalmazott>

    <alkalmazott ALK_ID="4" ALK_TELEP="4"> 
        <név>Tra Pista</név>
        <beosztás>marketing_manager</beosztás>
        <életkor>39</életkor>
        <születésiév>1984</születésiév>
    </alkalmazott>

    <alkalmazott ALK_ID="5" ALK_TELEP="2"> 
        <név>Viz Elma</név>
        <beosztás>hr_vezető</beosztás>
        <életkor>45</életkor>
        <születésiév>1978</születésiév>
    </alkalmazott>

    <!-- BONUSZ-->
    <bonusz BONUSZ_ID="1" ALKALMAZOTT_FK = "1" KÉPESÍTÉS_FK="1" >
        <extra>10000</extra>
    </bonusz>

    <bonusz BONUSZ_ID="2" ALKALMAZOTT_FK = "2" KÉPESÍTÉS_FK="2" >
        <extra>25000</extra>
    </bonusz>

    <bonusz BONUSZ_ID="3" ALKALMAZOTT_FK = "3" KÉPESÍTÉS_FK="3" >
        <extra>30000</extra>
    </bonusz>

    <!-- Képesítés-->
    <képesítés KÉPESÍTÉS_ID="1">
     <bizoszítványszám>7245889</bizoszítványszám>
     <év>2021</év>    
     <nyelv>angol</nyelv>
     <tipus>A2</tipus>   
    </képesítés>

    <képesítés KÉPESÍTÉS_ID="2">
        <bizoszítványszám>7245867</bizoszítványszám>
        <év>2015</év>    
        <nyelv>magyar</nyelv>
        <tipus>B2</tipus>    
    </képesítés>

    <képesítés KÉPESÍTÉS_ID="3">
        <bizoszítványszám>7224589</bizoszítványszám>
        <év>2010</év>    
        <nyelv>angol</nyelv>
        <tipus>C1</tipus>   
    </képesítés>

    <képesítés KÉPESÍTÉS_ID="4">
        <bizoszítványszám>7298174</bizoszítványszám>
        <év>2011</év>    
        <nyelv>angol</nyelv>
        <tipus>B1</tipus>  
    </képesítés>




</H2Z4X3_autokolcsonzo>
